Name,Start Time,End Time,Description,Price
"b'60th Annual San Francisco International Auto Show November 18-26, 2017'",2017-11-18T10:00:00,2017-11-26T20:00:00,"The San Francisco Chronicle 60h Annual International Auto Show presented by Golden 1 Credit Union returns to San Francisco's Moscone Center November 18, 2017 - November 26, 2017.
The San Francisco International Auto Show, which is supported by the California New Car Dealers Association, is the Bay Area’s largest and most prestigious auto exposition and the only show held regionally that lures the dazzling high-end displays from the world’s major automotive manufacturers.
Whether you're a car enthusiast, looking for a pressure-free non-sales environment to shop or research for your next car purchase, or just looking for affordable family fun, the 60th Annual San Francisco Auto Show will offer something for everyone. In addition to providing visitors with the opportunity to get an advance preview of the 2018 model vehicles, this year's Auto Show will feature: Test Drive opportunities from several manufacturers, alternative fuel and hi-tech vehicles; exotic sports cars; the Academy of Art University Classic Car Collection; an electric vehicle infrastructure and technology display from PG&E, the San Francisco Auto Salon with modified and custom cars showcasing aftermarket products plus exhibits from the Ferrari Club of America, the Aston Martin Club, and much much more.


SHOW HOURS & DATES:
Saturday, Nov. 18: 10:00 a.m. – 10:00 p.m.Sunday, Nov. 19: 10:00 a.m. – 9:00 p.m.Monday, Nov. 20: 10:00 a.m. – 9:00 p.m.Tuesday, Nov. 21: 10:00 a.m. – 9:00 p.m.Wednesday, Nov. 22: 10:00 a.m. – 9:00 p.m.Thursday, Nov. 23: 10:00 a.m. – 9:00 p.m.Friday, Nov. 24: 10:00 a.m. – 10:00 p.m.Saturday, Nov. 25: 10:00 a.m. – 10:00 p.m.Sunday, Nov. 26: 10:00 a.m. – 8:00 p.m.    


IMPORTANT NOTES:


Tickets may be purchased in advance for any day of the show.


The ticket is valid for one-time admission only.


The one-time admission can be any day from Nov 18 - Nov 26


All sales are final and nonrefundable.


Children 12 years and younger are free when accompanied by an adult.




Tickets are also available for purchase at the door for $10 (cash only). 


The participation and presence of any given manufacturer or vehicle make, model, color, and/or vehicle package, including but not limited to trim, equipment, interior, or options, is NOT guaranteed and is subject to change without notice at any time.  While the San Francisco International Auto Show makes efforts to communicate any such changes, the San Francisco International Auto Show shall not be held liable and refunds will not be issued if an exhibit or its contents differ from any advertisement, notice, announcement, or other form of communication.


For more information visit www.sfautoshow.com and follow us on Facebook, Instagram, Twitter, and Snapchat @SFAutoShow







",Paid
"b""Citizen @ Slim's   w/ Sorority Noise, Great Grandpa""",2017-11-17T19:30:00,2017-11-17T23:59:00,"Door 7:30 / Show 8:30
Citizen’s As You Please reports from ground zero of an epidemic. Two years removed from their previous Run For Cover LP, Everybody Is Going To Heaven, Citizen’s perspective is far less sublime. As You Please is a confrontational record, incapable of turning a blind eye toward the inescapable strife. And so, songwriter Mat Kerekes pursues the source of discontent that is ravaging his friends, his family, and his Rust Belt city of Toledo, Ohio with the band’s most dynamic record to date.
On As You Please the epidemic is bigger than addiction and overdoses. There is no longer a Dream to be pursued for the friends and family surrounding Citizen. The band explores that absence and the misguided ways in which it gets filled. On opener “Jet” the kids move slow and there’s a stranger living in the narrator’s home. Both are Kerekes’ discreet way of expressing the wreckage of widespread opiate addiction. “In The Middle Of It All” might be Citizen at their most hopeful, but it also reads as agonizing expression of the ruin in the Heartland.
As You Please also showcases the growing versatility of a band seven years deep and still restless. Citizen has fully outgrown the pop punk, but also refuses to brood in post-hardcore dirges. Written over the course of a year, the record is devoid of the brutish and sinister elements found on Everybody Is Going To Heaven. Here, Citizen go beyond the grunge to shoegaze contrasts and strive for something benevolent.
There’s a spiritual core to the record that manifests in subtle ways like the ethereal vocals echoing in the breakdown of “Control,” the droning organs on “You Are A Star” or the almost operatic refrain on “In The Middle Of It All.” The finespun ways in which Citizen has written this record mark a cataclysmic breakthrough for the band. There is damage and disarray in the band member’s daily lives, but within this record all the pieces have been restored in an ornate arrangement befitting a stained glass mosaic.
In the end, As You Please tries to give strength to those in need. There are illitic factors that control, but Citizen has written a guiding light of an album out of the debris. It concludes with “You Are A Star” and “Flowerchild;” one an unstable request of confidence set to soaring progressions, the other a blistering finale that subverts expectation. As You Please might read as meek, but it represents Citizen in its most confident and expansive state.
TICKET INFORMATION 
• Slim's is an ALL AGES (6+) venue.
• No refunds or exchanges are permitted, except in the case of headliner cancellation or date change. Opening acts are subject to change.
• There is an 8 ticket limit per customer unless otherwise stated.
• NEVER buy third party tickets (Craigslist, StubHub, etc.) for over face value. Scalped tickets may not be honored.
• Once you purchase, you will receive an order confirmation email from Eventbrite on behalf of Slim’s Presents.
• IMPORTANT: If you do not see your order confirmation in your inbox, make sure to check your junk/spam folder. If you still do not see your order confirmation, click here to access the Eventbrite help center.
• If you are having any other technical ticketing-related issues with your order, click here to contact Eventbrite. For general show info, click here.
",Paid
b'OPEN HOUSE Presentation of Design Opportunities',2017-11-15T17:00:00,2017-11-15T20:00:00,"




Design Teams have spent the last two months visiting places around San Francisco Bay, learning about the challenges our communities are facing related to severe storms, flooding and sea level rise, layered on the broader challenges around infrastructure, affordability and inequity throughout the Bay Area.
On November 15th, the Design Teams will publicly present 3-5 Design Opportunities - ideas that they have developed based on their research and expertise. The presentation of these ideas will be publicly live-streamed on our YouTube channel from 11:00am to 4:30pm.
That evening, Resilient by Design is hosting an Open House for visitors to view the final Design Opportunities, meet and ask Design Teams questions, and provide written input on their proposed designs*. The Design Opportunities vary in scope and scale to tackle current and future challenges around the bay due to flooding, sea level rise, and seismic risks.
This is a free event but tickets are limited so RSVP now!





* You can also view and provide feedback on the final proposed Design Opportunities online",Free
b'Stas Mikhavilov- The Best Day',2018-01-14T19:00:00,2018-01-14T21:00:00,"                        One of the most beloved Russian performers, Stas Mikhailov, presents his new program ""The Best Day!""
Великолепный певец, один из самых любимых и известных российских исполнителей, Стас Михайлов, представляет свою новую программу «Лучший день»!
Совершенно новая, яркая, по-настоящему теплая программа наполнена легкими, жизнерадостными песнями, под которые, как говорит сам артист: «можно петь и танцевать, оставив все свои заботы, просто отдохнуть душой и получить заряд положительной энергии». Не обойдется на концерте и без главных, определяющих творчество Михайлова песен о любви и о поиске смысла жизни, которые так давно знакомы и любимы почитателями его таланта. Абсолютно все песни Стаса посвящены прекрасным дамам, сильным мужчинам и их взаимоотношениям, - именно поэтому они так близки и понятны каждому, пришедшему на его концерт, а завораживающий и волнующий голос артиста уж точно не оставляет шанса уйти с равнодушным!
                    ",Paid
